"Date","Author","Verified","Helpful","Title","Body","Rating","Images","Videos","URL","Variation","Style"
"Reviewed in Canada on February 15, 2021","Amazon Customer","yes","-","Would purchase again","The perfect camera for inside and outside your home.","5","-","-","-","B07WTK627L","Size: One Pack with SD Card"
"Reviewed in Canada on October 14, 2020","Richard PIChÉ","yes","-","Bonne caméra","Pour vérifier mon garage","4","-","-","-","B07WTK627L","Size: One Pack with SD Card"
"Reviewed in Canada on January 9, 2021","Den","yes","-","Easy to use","Good and reliable camera","5","-","-","-","B07WTK627L","Size: One Pack with SD Card"
"Reviewed in Canada on February 15, 2021","Zohar","yes","-","Wow","Great product","5","-","-","-","B086YK22DL","Size: One Pack"
"Reviewed in Canada on August 19, 2020","Jason R.","-","yes","Nice design, good clear video quality, motion detection is a little weird.","The design of this camera is actually really nice, it looks almost (but not quite) up to the design and quality standards of something from Nest.  It doesn't look (or feel) like a cheap camera.  It comes with everything you need to get started, a 32GB ""Sandisk"" Micro SD card and a decent quality mount.  I put ""Sandisk"" in quotes because I'm not convinced that it's an authentic Sandisk memory card, but that being said, it seems to work fine and speeds test out OK on it.Setup of the camera confused me a bit at first... what got me was that it wasn't clear that the red LED light on the side of the camera that lights up when you plug it in to charge is actually a button you need to hold down to ""turn it on"".  The manual just says plug it in to turn it on, and doesn't mention that you need to hold this button (which just looks like an LED and not a button at all) down.  I also made the mistake at first of just choosing camera as the device type in the Arenti app, when there is a ""battery camera"" option further down which gives you more appropriate setup instructions for this model.  After figuring that part out, it was pretty smooth sailing... enter the wifi network you want it to connect to, hold a reset button down a bit to get the ""button"" flashing and then you literally just scan a QR code that the app generates on your phone screen by showing it to the camera.  It was easy and went smoothly.The camera can only connect to 2.4Ghz, which is always a bummer this day in age.  Technically, in Canada, we're not allowed to use 5ghz outdoors anyway so this isn't a big loss if you're the type of person that always wants to play by the rules but this is worth mentioning if you know you have a lot of 2.4Ghz pollution where you want to use it.  Charging the internal battery takes quite a long time, hours and hours, even using a really good USB charger (no charger is included in the box, you'll have to reuse one you already own or plug into a PC etc.).The app is fairly nicely designed and easy and intuitive enough to use.  There are a few quirks here and there but overall I think the app is on the better side of how bad these apps can be from relatively unknown brands like this.  Video quality when viewing through the app is pretty darn good for a camera of this price, I really don't have any complaints about the clarity - and the field of view is nice and wide as well which is useful for a camera meant for security.  Common things are all covered like setting notification schedules, motion sensitivity, clip length etc.  When the camera senses motion it will save a clip of fixed specified length to the SD card in the camera (and also upload to cloud, if you sign up for that service, which is not free after 3 months).  You can access the saved clips on the SD card directly from inside the camera using the app, you won't have to pull the SD card out to review footage.The motion detection works OK, mostly, but a couple times I thought there should have been an event and I couldn't find one.  I do have it set to low sensitivity though, because I want to avoid taking too many unnecessary clips filling up the onboard memory and wearing the battery down too fast.  The camera is basically ""sleeping"" until it sees motion, and then only wakes up long enough to record a clip, so the battery does seem to go a long way.  There is no option for continuous recording with this camera, but you can view live footage any time through the app on demand.","4","-","-","-","B07WTK627L","Size: One Pack with SD Card"
"Reviewed in Canada on December 11, 2020","GargaMel","-","yes","Works great","This cam is truly wireless, all you need to do is charge it. I find the charge lasts about a month.  It give a clear pic although the communications feature is sometimes delayed a few seconds, I think that's more to do with my slow internet connection.  The app is easy to use and the cam was quick to set up.  Overall, I'm thrilled with it.","5","-","-","-","B07WTK627L","Size: One Pack with SD Card"
"Reviewed in Canada on August 24, 2020","PROBE","-","-","Great quality camera","Pros:-Comes with 34gb SD card of good quality: It is rare that a security camera comes with the card itself-Pan and tilt is impressive: You can program it to follow movements automatically, and it does it smoothly without missing a step-Cheap price for a outdoor quality camera-Comes with all the necessary brackets-Easy pairing with iPhone app-Alerts are on point: It sends you a notification as soon as a motion is detected-Picture/video quality is decent during the dayCons:-Do require a power outlet: extra power cable not long enough. Will need to buy one for extra length-Small delay of a few second when sending a motion detection alert-Night vision is poor quality-Motion detection is very sensible even at it's lowest setting. It alerts you even if a cat is nearby which becomes annoying","5","-","-","-","B07WTK627L","Size: One Pack with SD Card"
"Reviewed in Canada on September 28, 2020","Sara ","-","yes","Quality equivalent to much more expensive models.","Good solid build.  This  Outdoor Security Surveillance Camera is well designed and feels pretty rugged.  It comes with everything you need to install - you supply an electrical outlet.The pan/tilt works smoothly and picture quality is good.  The alerts come pretty quickly once motion detector is activated.  Good value here.","4","-","-","-","B07WTK627L","Size: One Pack with SD Card"
"Reviewed in Canada on August 20, 2020","onecutreviews.com","-","-","Pretty good","This is a nice and inexpensive indoor/outdoor wifi camera with good battery life and full HD video quality even at night! Love that it is weatherproof and the installation was easy. The app, too, is quite intuitive. Go for it!","5","-","-","-","B07WTK627L","Size: One Pack with SD Card"
"Reviewed in the United States on March 8, 2021","Richard Donaldson","yes","-","Meh","They say the battery works for 4-6 months on one charge. It's more like 2 weeks at most.","2","-","-","https://www.amazon.com/gp/customer-reviews/RT0JTHQ9TKP6O/ref=cm_cr_getr_d_rvw_ttl?ie=UTF8&ASIN=B086YK22DL","B07WTK627L","Size: One Pack with SD Card"
"Reviewed in the United States on September 25, 2020","John Elliott","-","-","Great lower cost Arlo Competitor","All the battery operated cameras out there are just crazy expensive at this moment. Dropping a months worth salary like you're buying an engagement ring is not fun for some small wireless cameras. Thankfully today their are options.Enter the arlo competitor ""Arneti"" For the most part is works exactly the same, it has a large internal battery that you charge via a Mini-USB port and than mount on the stand and you're good to go. There is also a place for a Mini-SD card for recordings and they do offer a cloud based service to back stuff up to.The application itself is well made and just a bit behind arlo's finesse, but its darn close. Its easy to follow along and setup. You can get alerts on it and have a 2 way conversation as well. The unit itself is hefty in the hands and well made. It also screws into the base, unlike the arlo which magnetically connects. Which is a pain as where I live it gets windy and thats enough to push it around and bring it out of alignment. Ive also heard that the arlo is incredibly easy to steal. Someone need only walk up to it and grab it. As it has no mounts or wires, the would be thief just scored a multi-hundred dollar camera! I like that the arneti actually screws in which gives it a lot more support and prevents those criminals from taking it. Which is doubly important if you are only using the local DVR function as at that point they have the recording as well!Here are some pros and consPros:-Well made with quality feel and a certain weight to it-Easy mount options with the unit screwing into the base-Great motion detection and messaging to your phone-Good 2 way communication with clear sound-Incredible battery lifeCons-Picture life is good, but could be better-Night viewing is usable but could use more IR lights-Need strong and fast wifiAll in all this is a great competitor to arlo as well as other wireless cameras. You have to set realistic expectations though, this is not going to be a wired camera with 50 IR lights. Its battery operated and has to conserve battery life at the cost of picture quality and night vision.If you are looking for a wireless battery operated camera this one truly is the top of the field for price, picture, and ease of use.","4","-","-","https://www.amazon.com/gp/customer-reviews/R1UDS5FTNASJDD/ref=cm_cr_getr_d_rvw_ttl?ie=UTF8&ASIN=B086YK22DL","B086YK22DL","Size: One Pack"
"Reviewed in the United States on September 25, 2020","Michael JC","-","-","Exporting recordings is convoluted, app is not intuitive, motion detection is slow to record","Your browser does not support HTML5 video.                         I’m using this as a trail camera because I’ve got a spot where a lot of animals like to move through, and I wanted to capture that for later viewing. I already have several IP cameras for security purposes, but I keep them inside due to various constraints such as wires and concerns about someone tampering with them. With this camera and a similar one I already had, I can set them up virtually anywhere so long as I can get a wifi signal to them. With them having an internal battery and needing occasional charging, I don’t really want to put them somewhere inaccessible, but they are somewhat small and inconspicuous, and it’s easy enough to hide them in things, especially as I don’t need to worry about solar charging.This camera is limited in that there is no zoom, pan, or tilt. In addition, you can’t control it via a web page by plugging in the IP address. You need to go through the app to use them. You can’t do ONVIF with it either and control it with another program.The initial set-up is pretty easy and takes just a few minutes. You do need to have your phone on the same 2.4ghz wifi network to access the camera, and while there is an option to get a paid cloud service for storing photos and videos with this app, you can also have the data saved to a micro sd card. There is mounting hardware included, and I find that what is here is decent, probably better than what was included with a similar camera that I have.As far as the image quality goes, it’s not bad. It’s not the greatest in the world, but it takes good enough pictures and videos for its purpose. The quality seems to be fairly standard for IP cameras at 1080p. It also has the ability to do alarms, and it has a speaker for 2-way communication. I haven’t tried either of those as I don’t need those functions, but they’re there. I did notice, with the motion detection, that the videos are a bit slow to capture the motion. There is a picture alert, but the recorded video is missing the first couple seconds of activity, which is a shame as I’ve definitely missed some important activity, though it may be less of an issue depending on how far away a target has to be to trigger the alert.The battery life is a bit tough to determine. I don’t know what settings drain the battery more or less slowly, so I don’t know if my settings are causing the battery to drain particularly quickly, but after 3.5 days, the battery had already gone from 100% to 60%, though after another couple of days, it went down to 55%, so I’m not sure if the app accurately shows how the battery is draining. With a similar camera, which seems like it has similar settings, I’ve had it running continuously use for 23 days, and it’s battery level is at 45%.The biggest knock on this camera, by far, is the app. Even though there are limited things to mess around with, it’s not intuitive at all. In order to access much of what you can do, you have to click on the live view, and there you can access alert history, which has an odd interface, and if you go up at the top, there are 3 dots. Clicking on them allows you to access most of the settings for the camera. Unfortunately, there is no explanation for what these settings do or how to best make use of the features, so you’re left to yourself to explore and figure it out the best you can. The whole alert/alarm thing in there is a bit confusing. Also, there is no clear way to export the recordings to your phone or any other device, which seems like a pretty important feature. The app for my other camera has both a share feature and a download feature right there under each video. In case you are wondering, what does seem to work is to play a video and hit the record button, which seems to save the portion you manually recorded to your phone. You can also pause the video and capture an image. That is not even remotely intuitive, but that is the only way I’ve been able to take any of what was recorded to the SD card and export it through the app. You might be able to pull out the SD card and download the recordings, but it’s much better to be able to do it through the app. On the plus side, the live view and the viewing of the recordings works well, and the wifi signal seems to be a little better with this camera.Overall, I think this is a decent camera, and once you figure out the quirks, it seems to work well. I’m happy to have it, but I would like to see a better user interface with the app and better features for exporting the recordings. Though perhaps it is intentionally difficult to export so as to induce you to sign up for their cloud software.","3","https://images-na.ssl-images-amazon.com/images/I/615+VDi610L.jpg https://images-na.ssl-images-amazon.com/images/I/61R6HRkkWXL.jpg https://images-na.ssl-images-amazon.com/images/I/71nXgt8fg1L.jpg https://images-na.ssl-images-amazon.com/images/I/71qlSmfskbL.jpg","https://images-na.ssl-images-amazon.com/images/I/81RAPSqYgSS.mp4","https://www.amazon.com/gp/customer-reviews/R1MXQEPEYFW5S7/ref=cm_cr_getr_d_rvw_ttl?ie=UTF8&ASIN=B086YK22DL","B086YK22DL","Size: One Pack"
"Reviewed in the United States on September 21, 2020","Kiyo M.","-","-","Crippled app needs major work","Okay, I couldn't figure out where the power button was, as it's also the LED on the side. When you scan the QR code from your phone, it'll make a cuckoo sound.+ Microphone is loud+ Alexa support+ Low latency/acceptable quality+ camera body looks good/minimal/discreet; no ugly logos- The app is crippled. There is no way to delete a video from the app, which is ridiculous.- You can't SAVE a recorded video to your phone by just one simple click is outrageous; you have to actually manually hit record while the footage is playing back and stop to save that on your phone... having to do that on several footage is time consuming and terrible design.- Worst mount ever (I had to swap it with a different camera mount because the one included seriously stinks; you can't screw the camera tightly without the orientation to align the way you want - that's a really bad design.); a magnet-ball design would have been so much easier.- There's like 4 second delay when viewing with Amazon Echo- NO siren burglar alarm- NO built-in light- Videos saves as .data files (which I was able to view on Media Player Classic, but it won't let you fast foward/rewind)- Can't fast foward or seek while you're viewing full screen on the app (you have to scroll while you're minimized in the main timeline window)- Night Vision eats up battery (I turned it off)- Hate how you have to select ""Settings"" > ""Basic Function"" > ""Power management"" just to see the ACTUAL battery percentage... sooo inconvenient when it should give you an option to display the percentage on the main screen.It's a shame the app has to make so many things super inconvenient for the user when this camera has potential.","3","https://images-na.ssl-images-amazon.com/images/I/616s0aXch-L.jpg https://images-na.ssl-images-amazon.com/images/I/71Q-bwgnEIL.jpg https://images-na.ssl-images-amazon.com/images/I/71ZIHbKkuJL.jpg https://images-na.ssl-images-amazon.com/images/I/71oJK7lMPLL.jpg","-","https://www.amazon.com/gp/customer-reviews/R2H8853H72AD68/ref=cm_cr_getr_d_rvw_ttl?ie=UTF8&ASIN=B086YK22DL","B086YK22DL","Size: One Pack"
"Reviewed in the United States on September 24, 2020","Computer Doc","-","yes","Takes a lick'n keeps on tick'n","Camera quality is really good, and setup is simple installation had some issues.  When I was installing this on the outside of the house, I thought that since I was going into wood, it would be fine, that was a big mistake.  The anchors are there for a reason and don't try to use these screws in wood, it will strip the screws, I had a lot of problems with the screws, finally, I drilled bigger holes and put in the anchors and bought new screws and installation was a breeze.  The app is easy to use and get going, with the standard user and password, and cloud storage.  Night vision works well and there was motion detection on and it picked up the dogs.  When was installing the camera, I dropped it from about 12 ft and I was expecting cracks or totally unusable and it only had a couple of scratches, so I was impressed with the durability of this.","5","https://images-na.ssl-images-amazon.com/images/I/61p8Np6i-QL.jpg https://images-na.ssl-images-amazon.com/images/I/71Lo7DVp0xL.jpg https://images-na.ssl-images-amazon.com/images/I/71T0rCjk6nL.jpg","-","https://www.amazon.com/gp/customer-reviews/RJQRS1UUGSZAM/ref=cm_cr_getr_d_rvw_ttl?ie=UTF8&ASIN=B086YK22DL","B086YK22DL","Size: One Pack"
"Reviewed in the United States on October 11, 2020","fuss1","-","yes","Good Wi-Fi camera and app","Intro: I ordered this Wi-Fi camera to use at home. My plan is to ultimately install it outside to cover my driveway.Pro’s:• Good quality pictures and video• Expandable memory with Micro-SD slot• Easy set-up with appCon’s:• Battery life is a major question for me at this point. I set this up in my office to test if out and after a little over a month the unit is down to 34% battery.Final thoughts: This is a good Wi-Fi camera that works well but I fear if I put this outside in the cold the battery life might be shortened even more. I’ll come back to update my review if this doesn’t meet expectations once I get this mounted outside","5","-","-","https://www.amazon.com/gp/customer-reviews/R2260VKWGOTR55/ref=cm_cr_getr_d_rvw_ttl?ie=UTF8&ASIN=B086YK22DL","B086YK22DL","Size: One Pack"
"Reviewed in the United States on February 3, 2021","Dwayne Hayes","-","yes","Easy to use wireless security camera.","The cameras were easy to set up and use, they also work great. It will be interesting to see what the actual battery life acually is, especially during the summer heat. The picture quality is great along with the motion detection. The only issue was with the screws that were provided, every screw head stripped when applying, had to purchase all new higher quality screws for installation.","5","-","-","https://www.amazon.com/gp/customer-reviews/R9U2QRZMRQLYO/ref=cm_cr_getr_d_rvw_ttl?ie=UTF8&ASIN=B086YK22DL","B07WTK627L","Size: One Pack with SD Card"
"Reviewed in the United States on September 13, 2020","BLB","-","yes","Very happy with this battery camera","I got this camera so I could move it around my yard and watch my dogs without having to plug it in. This camera was SUPER easy to set up and get going, literally took no more than 10 minutes. The picture quality is very good and I can see my whole backyard.  I am super happy with this camera, it exceeded my expectations. I am planning to buy at least  one more of these camera's and I definitely recommend it!!","5","https://images-na.ssl-images-amazon.com/images/I/31PocI5DQQL.jpg https://images-na.ssl-images-amazon.com/images/I/41XEDOEp9EL.jpg https://images-na.ssl-images-amazon.com/images/I/5120vk0P5+L.jpg","-","https://www.amazon.com/gp/customer-reviews/RNVN4123MNLMV/ref=cm_cr_getr_d_rvw_ttl?ie=UTF8&ASIN=B086YK22DL","B086YK22DL","Size: One Pack"
"Reviewed in the United States on November 9, 2020","Miss Campbell","-","-","Easy installation","This camera was really easy to install and has a very intuitive operating process.The software on the phone is a bit slow. When the program app is initiated, it takes quite a while for the components to load and for it to be operational.The camera quality is good, but the motion detection could use some upgrading, especially with the speed.","4","-","-","https://www.amazon.com/gp/customer-reviews/R19F1O0K06CO17/ref=cm_cr_getr_d_rvw_ttl?ie=UTF8&ASIN=B086YK22DL","B086YK22DL","Size: One Pack"
"Reviewed in the United States on January 10, 2021","Sean McGill","-","-","Works good, did notice some moisture at times on my lens","I noticed with this cam about 10 more feet of WiFi then similar models.The only drawback is it is more prone to moisture collecting on outside of lens,Not sure if it is coated as well?Overall, very good and seems like a great built in WiFi antenna reception.","4","https://images-na.ssl-images-amazon.com/images/I/51icgMH6AOL.jpg","-","https://www.amazon.com/gp/customer-reviews/R25JRMHFC5FZNH/ref=cm_cr_getr_d_rvw_ttl?ie=UTF8&ASIN=B086YK22DL","B086YK22DL","Size: One Pack"
"Reviewed in the United States on January 31, 2021","dessie","-","-","Clear videos","Great product for the money","5","-","-","https://www.amazon.com/gp/customer-reviews/RF60V3RDVBHHA/ref=cm_cr_getr_d_rvw_ttl?ie=UTF8&ASIN=B086YK22DL","B07WTK627L","Size: One Pack with SD Card"
"Reviewed in the United States on March 2, 2021","Amazon Customer","-","-","Camera","Need better instructions","5","-","-","https://www.amazon.com/gp/customer-reviews/R3I6EAUV6DG6TO/ref=cm_cr_getr_d_rvw_ttl?ie=UTF8&ASIN=B086YK22DL","B07WTK627L","Size: One Pack with SD Card"
"Reviewed in the United States on January 7, 2021","patrick heppard","-","-","Nice","Nice","5","-","-","https://www.amazon.com/gp/customer-reviews/R3U5OQ288RLL4C/ref=cm_cr_getr_d_rvw_ttl?ie=UTF8&ASIN=B086YK22DL","B086YK22DL","Size: One Pack"
"Reviewed in the United States on February 13, 2021","Ernesto tejeda","-","-","Es muy practica y fácil de utilizar","Fácil de configurar y rápido muy bueno","5","-","-","https://www.amazon.com/gp/customer-reviews/R3B944SGR2FIJW/ref=cm_cr_getr_d_rvw_ttl?ie=UTF8&ASIN=B086YK22DL","B07WTK627L","Size: One Pack with SD Card"
"Reviewed in Canada on February 23, 2021","Josée Pilote","yes","-","Je la recommande","Je l’aime beaucoup, il est à l’extérieur au grand froid québécois et fonctionne très bien.  Je l’ai depuis environ un mois. L’application est très fonctionnel!","4","-","-","-","B07WTK627L","Size: One Pack with SD Card"
"Reviewed in Canada on December 10, 2020","Drum Slave","yes","-","Great camera. Excellent product.","Awesome camera!!!The picture is very clear and the motion detector is very effective.We're very happy with the purchase. Highly recommended.","5","-","-","-","B07WTK627L","Size: One Pack with SD Card"
"Reviewed in Canada on February 21, 2021","rNd","yes","-","Good image quality for wireless camera","Good battery life and great connection, love how it works with Alexa and shows me the footage on my Echo Show when there's motion detected!","5","-","-","-","B07WTK627L","Size: One Pack with SD Card"
"Reviewed in Canada on February 8, 2021","justin","yes","yes","Sucks balls","Won't hook up. And yes, I'm very familiar with what I'm doing.  I'll see if I have the patience to try again, and again...","1","-","-","-","B086YK22DL","Size: One Pack"
"Reviewed in Canada on September 29, 2020","Eugene Dinnall","yes","-","Great product!","Very happy with the camera. Had trouble at first resetting our WiFi to 2.4 GHz. Once that was accomplished, you are off to the races.They have a decent customer support team as well.","5","-","-","-","B07WTK627L","Size: One Pack with SD Card"
"Reviewed in Canada on January 25, 2021","Abdulla Junaid","yes","-","Affordable and good quality outdoor camera","Good outdoor camera with good hard ware and soft ware","5","-","-","-","B07WTK627L","Size: One Pack with SD Card"
"Reviewed in the United States on September 9, 2020","Sam I Am","yes","yes","Must have internet, files on microSD card are not computer readable","Do not buy this if you don't have a constant on internet connection, I wanted to put this at a remote location that does not have internet and it will not function without one.Also, the files recorded to the microSD card are readable by the camera via the app but not by a computer.Decent enough app and build quality but understand the limitations before you buy.","3","-","-","https://www.amazon.com/gp/customer-reviews/R1JH2T06WWSL9M/ref=cm_cr_getr_d_rvw_ttl?ie=UTF8&ASIN=B086YK22DL","B07WTK627L","Size: One Pack with SD Card"
